{
  "schema_version": "livefire.rag.evidence-query-authoring-worklist/1",
  "suite_contract": "livefire-23-cloud-53-bots-v1",
  "status": "awaiting_independent_authoring",
  "coverage_plan_sha256": "c398334a713c3063de4bee10600f87b36e4be731cfc182c19ba466909aa34a0f",
  "policy": {
    "required_surfaces": [
      "analyst_question",
      "terse_soc",
      "entity_light_paraphrase"
    ],
    "answer_values_visible_to_author": false,
    "candidate_rankings_visible_to_author": false,
    "forbidden_literal_classes": [
      "event_id",
      "exact_timestamp",
      "principal_or_host",
      "resource_identifier",
      "hash",
      "answer_only_command_fragment",
      "evaluator_conclusion"
    ],
    "activation_requirements": [
      "query_text_lock",
      "leakage_audit",
      "candidate_universe",
      "qrel_adjudication",
      "hard_negative_adjudication"
    ]
  },
  "summary": {
    "eligible_atoms": 34,
    "required_surfaces": 102,
    "by_cohort": {
      "bots_native": 21,
      "cloud": 13
    },
    "by_assist_mode": {
      "direct_single": 23,
      "exact_metadata": 6,
      "retrieve_then_compute": 5
    }
  },
  "atoms": [
    {
      "benchmark_id": "botsv3-cloud-incident-chain",
      "atom_id": "chain-acl-event",
      "question_id": "cloud-chain-001",
      "domain": "public-bucket-browser-mining",
      "cohort": "cloud",
      "incident_id": "public-bucket-browser-mining",
      "resampling_cluster_id": "incident:public-bucket-browser-mining",
      "phase_id": "root-authentication",
      "scope_ids": [
        "cloud-control-plane",
        "object-storage"
      ],
      "assist_mode": "exact_metadata",
      "safe_summary": "Public ACL change event",
      "answer_free_atom_sha256": "2586e92a9fc7f8dcbcb302184f6dfd93f12bcf6bdd6165c9a696b88e9ee6cc8a",
      "required_surfaces": [
        "analyst_question",
        "terse_soc",
        "entity_light_paraphrase"
      ],
      "authoring_status": "pending_blinded_author",
      "next_receipts": [
        "query_text_lock",
        "leakage_audit",
        "candidate_universe",
        "qrel_adjudication",
        "hard_negative_adjudication"
      ]
    },
    {
      "benchmark_id": "botsv3-cloud-incident-chain",
      "atom_id": "chain-bucket",
      "question_id": "cloud-chain-002",
      "domain": "public-bucket-browser-mining",
      "cohort": "cloud",
      "incident_id": "public-bucket-browser-mining",
      "resampling_cluster_id": "incident:public-bucket-browser-mining",
      "phase_id": "root-authentication",
      "scope_ids": [
        "object-storage"
      ],
      "assist_mode": "direct_single",
      "safe_summary": "Exposed storage resource",
      "answer_free_atom_sha256": "a4569537d88c860c5d9dd9376636f961c9b98b4327ff82a1ae3f8939b27f3edd",
      "required_surfaces": [
        "analyst_question",
        "terse_soc",
        "entity_light_paraphrase"
      ],
      "authoring_status": "pending_blinded_author",
      "next_receipts": [
        "query_text_lock",
        "leakage_audit",
        "candidate_universe",
        "qrel_adjudication",
        "hard_negative_adjudication"
      ]
    },
    {
      "benchmark_id": "botsv3-cloud-incident-chain",
      "atom_id": "chain-actor-auth",
      "question_id": "cloud-chain-003",
      "domain": "public-bucket-browser-mining",
      "cohort": "cloud",
      "incident_id": "public-bucket-browser-mining",
      "resampling_cluster_id": "incident:public-bucket-browser-mining",
      "phase_id": "root-authentication",
      "scope_ids": [
        "cloud-control-plane"
      ],
      "assist_mode": "direct_single",
      "safe_summary": "Direct IAM-user console session authentication",
      "answer_free_atom_sha256": "3b7742deaff5351b909b4e5cb48f1c2e572be6abefbb79e6f844b1e06406e513",
      "required_surfaces": [
        "analyst_question",
        "terse_soc",
        "entity_light_paraphrase"
      ],
      "authoring_status": "pending_blinded_author",
      "next_receipts": [
        "query_text_lock",
        "leakage_audit",
        "candidate_universe",
        "qrel_adjudication",
        "hard_negative_adjudication"
      ]
    },
    {
      "benchmark_id": "botsv3-cloud-incident-chain",
      "atom_id": "chain-public-grants",
      "question_id": "cloud-chain-004",
      "domain": "public-bucket-browser-mining",
      "cohort": "cloud",
      "incident_id": "public-bucket-browser-mining",
      "resampling_cluster_id": "incident:public-bucket-browser-mining",
      "phase_id": "root-authentication",
      "scope_ids": [
        "cloud-control-plane",
        "object-storage"
      ],
      "assist_mode": "direct_single",
      "safe_summary": "Public principal received read and write grants",
      "answer_free_atom_sha256": "a244b4e0338611c31b95d04f894ed8edb98ac8bd0433dc3f31359947a3c7183e",
      "required_surfaces": [
        "analyst_question",
        "terse_soc",
        "entity_light_paraphrase"
      ],
      "authoring_status": "pending_blinded_author",
      "next_receipts": [
        "query_text_lock",
        "leakage_audit",
        "candidate_universe",
        "qrel_adjudication",
        "hard_negative_adjudication"
      ]
    },
    {
      "benchmark_id": "botsv3-cloud-incident-chain",
      "atom_id": "chain-marker-upload",
      "question_id": "cloud-chain-006",
      "domain": "public-bucket-browser-mining",
      "cohort": "cloud",
      "incident_id": "public-bucket-browser-mining",
      "resampling_cluster_id": "incident:public-bucket-browser-mining",
      "phase_id": "public-exploitation",
      "scope_ids": [
        "object-storage"
      ],
      "assist_mode": "direct_single",
      "safe_summary": "Anonymous warning marker upload",
      "answer_free_atom_sha256": "f815cd8afd7dd2d281095d3c3d7e559177b463e001daebea15647b64b54c54d7",
      "required_surfaces": [
        "analyst_question",
        "terse_soc",
        "entity_light_paraphrase"
      ],
      "authoring_status": "pending_blinded_author",
      "next_receipts": [
        "query_text_lock",
        "leakage_audit",
        "candidate_universe",
        "qrel_adjudication",
        "hard_negative_adjudication"
      ]
    },
    {
      "benchmark_id": "botsv3-cloud-incident-chain",
      "atom_id": "chain-archive-overwrite",
      "question_id": "cloud-chain-007",
      "domain": "public-bucket-browser-mining",
      "cohort": "cloud",
      "incident_id": "public-bucket-browser-mining",
      "resampling_cluster_id": "incident:public-bucket-browser-mining",
      "phase_id": "public-exploitation",
      "scope_ids": [
        "object-storage"
      ],
      "assist_mode": "direct_single",
      "safe_summary": "Anonymous application-archive overwrite",
      "answer_free_atom_sha256": "3237bf8a16140066cb0577f585312b3a289669706cec2deea4d5290edb756532",
      "required_surfaces": [
        "analyst_question",
        "terse_soc",
        "entity_light_paraphrase"
      ],
      "authoring_status": "pending_blinded_author",
      "next_receipts": [
        "query_text_lock",
        "leakage_audit",
        "candidate_universe",
        "qrel_adjudication",
        "hard_negative_adjudication"
      ]
    },
    {
      "benchmark_id": "botsv3-cloud-incident-chain",
      "atom_id": "chain-instance-termination",
      "question_id": "cloud-chain-008",
      "domain": "public-bucket-browser-mining",
      "cohort": "cloud",
      "incident_id": "public-bucket-browser-mining",
      "resampling_cluster_id": "incident:public-bucket-browser-mining",
      "phase_id": "deployment-propagation",
      "scope_ids": [
        "cloud-control-plane",
        "deployment"
      ],
      "assist_mode": "direct_single",
      "safe_summary": "Console user terminated running Auto Scaling members",
      "answer_free_atom_sha256": "b0daa3a6acc41eda1cb502e78b5a3b06dfa50483e2f266ba3b27f4390ce08cbb",
      "required_surfaces": [
        "analyst_question",
        "terse_soc",
        "entity_light_paraphrase"
      ],
      "authoring_status": "pending_blinded_author",
      "next_receipts": [
        "query_text_lock",
        "leakage_audit",
        "candidate_universe",
        "qrel_adjudication",
        "hard_negative_adjudication"
      ]
    },
    {
      "benchmark_id": "botsv3-cloud-incident-chain",
      "atom_id": "chain-instance-launch",
      "question_id": "cloud-chain-009",
      "domain": "public-bucket-browser-mining",
      "cohort": "cloud",
      "incident_id": "public-bucket-browser-mining",
      "resampling_cluster_id": "incident:public-bucket-browser-mining",
      "phase_id": "deployment-propagation",
      "scope_ids": [
        "deployment"
      ],
      "assist_mode": "direct_single",
      "safe_summary": "Auto Scaling launched a replacement web instance",
      "answer_free_atom_sha256": "9b1fdc1df351590b1ef86497b28c021baaf1efeb0718b96e95b8976917b98370",
      "required_surfaces": [
        "analyst_question",
        "terse_soc",
        "entity_light_paraphrase"
      ],
      "authoring_status": "pending_blinded_author",
      "next_receipts": [
        "query_text_lock",
        "leakage_audit",
        "candidate_universe",
        "qrel_adjudication",
        "hard_negative_adjudication"
      ]
    },
    {
      "benchmark_id": "botsv3-cloud-incident-chain",
      "atom_id": "chain-target-registration",
      "question_id": "cloud-chain-010",
      "domain": "public-bucket-browser-mining",
      "cohort": "cloud",
      "incident_id": "public-bucket-browser-mining",
      "resampling_cluster_id": "incident:public-bucket-browser-mining",
      "phase_id": "deployment-propagation",
      "scope_ids": [
        "deployment",
        "service-delivery"
      ],
      "assist_mode": "direct_single",
      "safe_summary": "New instance entered the web target group",
      "answer_free_atom_sha256": "93a7927b895aa0eea1de840830afb1516f0b5c725ad1b8c9739ce3d8cdfb0ef4",
      "required_surfaces": [
        "analyst_question",
        "terse_soc",